{
  "$schema": "../config.schema.json",
  "version": 2,
  "default_response": {
    "status": 404,
    "content_type": "text/plain; charset=utf-8",
    "body": "Not found\n"
  },
  "tokens": [
    {
      "id": "secret-document",
      "path": "/v1/get-pass",
      "query": {
        "user": "jack"
      },
      "note": "Example: URL embedded in secret.doc",
      "response_ref": "pixel"
    },
    {
      "id": "login-breadcrumb",
      "path": "/v1/get-pass",
      "query": {
        "page": "2"
      },
      "note": "Example: hidden link in login page"
    }
  ],
  "alerts": {
    "timeout_ms": 2000,
    "cooldown_seconds": 60
  },
  "capture_body_bytes": 0,
  "trusted_proxies": [],
  "responses": {
    "pixel": {
      "status": 200,
      "content_type": "image/png",
      "body_base64": "iVBORw0KGgoAAAANSUhEUgAAAAEAAAABCAQAAAC1HAwCAAAAC0lEQVR4nGP6zwAAAgcBApocMXEAAAAASUVORK5CYII="
    }
  }
}
